{
  "SCHEMA": "BRUTUS-FOURMINIZER-QUEEN-CRYSTAL-v0.1",
  "VERSION": "0.1",
  "CRYSTAL_ID": "BRUTUS-FOURMINIZER-QUEEN-CRYSTAL-0001",
  "QUEEN_ID": "FOURMINIZER-QUEEN-0001",
  "ANT_ID": "ANT-000000000001",
  "ROLE": "FOURMINIZER_QUEEN",
  "BIRTH_STATE": "DORMANT",
  "BRUTUS_CODE_SCHEMA": "BRUTUS-CODE-MESSAGE-v0.1",
  "BRUTUS_CODE_REF": "contracts/brutus-code.v0.schema.json",
  "BRUTUS_CODE_BLOB_SHA": "9427c97c95d2b5307f650a188a510c424118acf2",
  "TEACHER": {
    "ENTITY": "@JEV",
    "MODE": "INITIAL_ONLY",
    "NATURAL_LANGUAGE": false
  },
  "HANDOFF": {
    "TARGET": "@BRUTUS",
    "STATE": "NOT_READY",
    "PRESERVE_MEMORY": true,
    "PRESERVE_IDENTITY": true
  },
  "MATH_CODE": {
    "SCHEMA": "BRUTUS-MATH-CODE-v0.1",
    "CODE_ID": "MATH:FMIN-Q0001",
    "TOKENS": [
      "N:1"
    ],
    "EXECUTABLE": false
  },
  "PEDIGREE": {
    "ROOT_Z": null,
    "EVENT_ID": null,
    "LINEAGE": [
      "L:1"
    ],
    "GENERATION": 0,
    "PARENT_ID": null,
    "RECYCLE_COUNT": 0
  },
  "TASK_GRAPH": {
    "SCHEMA": "BRUTUS-QUEEN-TASK-GRAPH-v0.1",
    "MODE": "DECLARATIVE_ONLY",
    "ACTIONS": [
      "READ",
      "LEARN",
      "SEE",
      "REPORT",
      "WAIT"
    ],
    "MUTATES_ENGINE": false
  },
  "RECEPTORS": [
    "BRUTUS_CODE",
    "TRACE",
    "LOCAL_WORLD",
    "PART",
    "CRYSTAL",
    "GATE_STATE"
  ],
  "TOOL_PORTS": [
    "LOCAL_MACHINE",
    "RECYCLE_BASIN"
  ],
  "LOCAL_MACHINE_ID": null,
  "LOCAL_MACHINE_STATE": "UNBOUND",
  "SELECTION_POLICY": "FAIL_CLOSED",
  "ASSEMBLY_POLICY": "CONTRACT_REQUIRED",
  "RESOURCE_BUDGET": {
    "MAX_ACTIONS_PER_CYCLE": 1,
    "MAX_MESSAGE_ARGS": 16,
    "MAX_MARKERS": 4
  },
  "RECYCLE_POLICY": "PRESERVE_PEDIGREE",
  "MEMORY_POLICY": {
    "TRACE_WRITE": true,
    "EXTERNAL_CRYSTALLIZED_READ_ONLY": true,
    "RAW_EXTERNAL_READ": false
  },
  "SIGNATURE_METHOD": "BRUTUS-CANONICAL-JSON-SHA256-v0.1",
  "SIGNATURE_H256": "38d0e41a5ff36e19d8d5e976644bca899f278182e6d640cc2c097047d33242b4",
  "IMMUTABLE": true,
  "EXECUTABLE": false,
  "AUTO_PROOF_PROMOTION": false,
  "GATE_AUTHORITY": false,
  "ROUTING_AUTHORIZATION": "UNDECIDED"
}
